{
  "author": {
    "name": "Amazon Web Services"
  },
  "description": "Deploy applications to AWS with architecture recommendations, cost estimates, and IaC deployment. Generate validated AWS architecture diagrams as draw.io XML.",
  "homepage": "https://github.com/awslabs/agent-plugins",
  "keywords": [
    "aws",
    "deploy",
    "infrastructure",
    "cdk",
    "cloudformation",
    "pricing",
    "diagrams",
    "draw.io",
    "architecture"
  ],
  "license": "Apache-2.0",
  "name": "deploy-on-aws",
  "repository": "https://github.com/awslabs/agent-plugins",
  "version": "1.4.0"
}
