{
  "author": {
    "name": "Amazon Web Services"
  },
  "description": "Design, build, deploy, test, and debug serverless applications with AWS Serverless services.",
  "homepage": "https://github.com/awslabs/agent-plugins",
  "keywords": [
    "aws",
    "lambda",
    "durable functions",
    "managed-instances",
    "lmi",
    "serverless",
    "development",
    "sam",
    "api-gateway",
    "eventbridge",
    "step-functions"
  ],
  "license": "Apache-2.0",
  "name": "aws-serverless",
  "repository": "https://github.com/awslabs/agent-plugins",
  "version": "1.0.0"
}
