{
  "author": {
    "name": "Amazon Web Services"
  },
  "description": "Guide developers through adding maps, places search, geocoding, routing, and other geospatial features with Amazon Location Service, including authentication setup, SDK integration, and best practices.",
  "keywords": [
    "location",
    "maps",
    "geocoding",
    "routing",
    "places",
    "geofencing",
    "tracking",
    "amazon-location",
    "maplibre",
    "address",
    "coordinates"
  ],
  "license": "Apache-2.0",
  "name": "amazon-location-service",
  "repository": "https://github.com/awslabs/agent-plugins",
  "version": "1.1.1"
}
